{"changes_valid":true,"errors":["","","","",""],"evaluations_valid":true,"events_valid":true,"format":"relay-run-verification-v1","integrity_valid":true,"ok":true,"packet_manifest_required":true,"packet_manifest_valid":true,"receipts_consistent":true,"receipts_valid":true,"report_valid":true,"run_id":"relay-provider-tools-mission-1790100834107-648860","state_valid":true,"status":"completed","tool_results_required":true,"tool_results_valid":true}
